1;1;Donut chart;02;1;Stacked bar chart;13;1;Funnel chart;04;1;Grouped line chart;15;2;Any account created in the last 30 days;06;2;All recently accessed accounts;17;2;Accounts selected with the sync button;08;2;Accounts that the user owns;09;3;Upload AppExchange Packages;010;3;Create AppExchange Packages;011;3;Download AppExchange Packages;112;3;Manage Package Licenses;013;4;Enhanced page layout editor;114;4;Enhanced lists;115;4;Inline editing;116;4;Enhanced profile list views;017;5;Manage users within specified roles;118;5;Log in as a user who has granted login access;119;5;Reset passwords for all users;020;5;Manage specified custom objects;121;5;Create new user profiles;022;6;Revenue  ;123;6;Forecast;024;6;Production  ;025;6;Quantity  ;126;7;Use the campaign influences related list on the opportunity  ;127;7;Select the campaign record type when creating the opportunity  ;028;7;Select the primary campaign source for the opportunity  ;129;7;Use the campaign hierarchy related list on the opportunity;030;8;Create a sharing rule to grant access to members of the public group.  ;031;8;Manually share each account record with members of the public group.  ;032;8;Update the organization - wide defaults for accounts to private and create a sharing rule for the group.  ;133;8;Upgrade the role hierarchy and assign members of the group to a role at the top of the hierarchy.;034;9;Create a formula field to calculate the discounted amount.  ;135;9;Create an auto-number field to calculate the discounted amount.  ;036;9;Create a cross object formula field to calculate the discounted amount.  ;037;9;Create a roll-up summary field to calculate the discounted amount.;038;10;Enable Chatter for specific users  ;039;10;Enable customizable recent items  ;040;10;Enable enhanced list views  ;141;10;Enable hover details  ;142;10;Enable spell checker;143;11;Read for Accounts  ;044;11;View All for Opportunities  ;145;11;Read for Opportunities  ;046;11;View All Data;047;12;"Add Amy to the ""Sales East"" public group  ";048;12;Add Amy to Bob's default account team  ;149;12;"Create a sharing rule between the ""Sales West"" and ""Sales East"" public groups  ";050;12;Add Amy to the role above Bob in the role hierarchy;051;13;An existing custom object record  ;052;13;An existing opportunity record  ;153;13;An existing account record  ;154;13;An existing contact record;055;14;The user will be logged out and any unsaved work in progress will be saved  ;056;14;The user will be able to continue working and start new sessions  ;057;14;The user will be able to continue working, but will be unable to start any new sessions  ;058;14;The user will be logged out and any unsaved work in progress will be lost;159;15;Roll-up summary fields can be created for tasks  ;060;15;Record types can be created for tasks  ;161;15;Validation rules can be created for tasks  ;162;15;Recurring tasks can be assigned to more than one user;063;16;Status  ;164;16;Categories  ;065;16;Sharing Rules  ;166;16;Workflow Rules;167;17;Formula fields can reference themselves in the formula  ;068;17;Formula fields can reference fields on a child object  ;069;17;Formula fields are read-only on record detail pages  ;170;17;Formula fields can reference fields on a parent object;171;18;Public groups can be used when manually sharing a record  ;172;18;Public groups can be used in sharing rules  ;173;18;Public groups can be created by any user  ;074;18;Public groups allow users to delete personal accounts;075;19;Use a validation rule to prevent the software from access the services team's sales process  ;076;19;Create a record type for each sales process and assign it to the appropriate profiles  ;177;19;Create a separate lead process for the software sales team and service sales team  ;078;19;Create a unique list of opportunity stage picklist values for each sales process;179;20;Excel Connector  ;080;20;Import Wizard  ;081;20;Data Loader  ;182;20;Mass Delete;183;21;Change the login IP ranges  ;084;21;Unlock the user  ;085;21;View the login history  ;186;21;Reset the password;087;22;Profile  ;188;22;Field level security  ;089;22;Sharing  ;090;22;Page layout;091;23;Create a new profile for Retirement Sales team members and remove read access to High Wealth account records.  ;092;23;Set the organization-wide default sharing to private and create a sharing rule to share Retirement accounts with all Sales users  ;193;23;Create a new record type for high Wealth accounts and share the record type with High Wealth sales team members  ;094;23;Set the organization-wide default sharing to public read-only and create a sharing rule to limit access to High Wealth accounts;095;24;It must be enabled by an administrator  ;196;24;It is available to customer portal users  ;097;24;It is available to users without a mobile license  ;198;24;It is available to partner portal users;099;25;Import Wizard  ;1100;25;Validation rules  ;0101;25;Merge Leads Function  ;0102;25;Data Loader;0103;26;Create new records from a list view  ;1104;26;Edit dependent picklists inline from a list view  ;0105;26;Edit multiple records directly from a list view  ;1106;26;Calculate the sum of a number field displayed in a list view;0107;27;Build a lead source report to summarize the campaign metrics  ;0108;27;Establish the campaign influence between related campaigns  ;0109;27;Create a campaign hierarchy and include the related campaigns  ;1110;27;Create a cross object formula field to calculate summary metrics;0111;28;The object included in the report  ;1112;28;The fields available to include in the report  ;1113;28;Whether the report will be tabular, summary, or matrix  ;0114;28;Whether the report can be displayed in a dashboard  ;0115;28;The default columns in the report;1116;29;Store Chatter posts in a Salesforce Content group  ;0117;29;Link a Salesforce Content library to a Chatter profile  ;0118;29;View a list of files shared with a Chatter group  ;1119;29;Post files from a Salesforce Content library to a Chatter feed;1120;30;Create a validation rule to prevent lead conversion  ;0121;30;Create two separate lead process and record types  ;1122;30;Use field-level security to restrict access to the lead status values  ;0123;30;Create two separate page layouts;0124;31;Create a cross-object formula field on the account  ;0125;31;Create a roll up summary field on the opportunity  ;0126;31;Create a cross-object formula field on the opportunity  ;1127;31;Create an account workflow rule with an opportunity field update;0128;32;Set the field to hidden on the user profile  ;0129;32;Remove the field from reports and list views  ;0130;32;Set the field to hidden using field level security  ;1131;32;Remove the field from the page layout;0132;33;List views can be filtered by tags  ;0133;33;List views can be filtered using AND, OR and NOT filters  ;1134;33;List views can be filtered by record owner profile  ;0135;33;List views can be filtered by record ownership;1136;34;Case Teams  ;1137;34;Partner Roles  ;0138;34;Sales Teams  ;0139;34;Contact Roles;0140;35;Sharing Rules  ;0141;35;Source Report folder access  ;1142;35;Dashboard folder access  ;1143;35;Dashboard properties;0144;36;Generates URLs for content files  ;1145;36;Track how often content is viewed if downloaded  ;1146;36;Publishes content from Salesforce to a company's website  ;0147;36;Makes content available to recipients within and outside of Salesforce  ;1148;36;Tracks which recipients have viewed and downloaded content;0149;37;Set the field-level security for account number to visible and read only for the sales user profile  ;1150;37;"Remove the ""Edit"" permission on the account object for the sales user profile  ";0151;37;Set the account number field to read-only on the page layout assigned to the sales user profile  ;0152;37;Set the organization-wide default settings for accounts to read only;0153;38;Before Apex Triggers  ;0154;38;After assignment rules  ;1155;38;After validation rules  ;1156;38;After escalation rules;0157;39;Include attachments  ;1158;39;Schedule a recurring export  ;1159;39;Include the values for formula fields  ;0160;39;Export a subset of records for a given object;0161;40;Excel connector  ;0162;40;Connect for Office  ;0163;40;Import Wizard  ;1164;40;Data Loader;0165;41;Record types can be used to define picklist values available for a given field  ;1166;41;The ability to create records of a specific record type is determined by the profile  ;1167;41;Users cannot view records assigned to a record type their profile does not have access to  ;0168;41;Record types can only be assigned to one profile at a time;0169;42;The field values are archived in the setup audit trail  ;0170;42;The field is removed from the associated workflow rules  ;0171;42;The field history tracking data is deleted  ;1172;42;The field is removed from the associated page layouts;1173;43;The user must opt in to receive email alerts when an approval is requested  ;0174;43;The user must have read permission for the object in the approval process  ;1175;43;The user must be in the same role as the approval submitter in the role hierarchy  ;0176;43;The user must be setup as a delegated approver;0177;44;Create users in the organization and assign them a chatter free license  ;1178;44;Assign Chatter Free licenses to users outside the specified email domains  ;0179;44;Enable invites to allow users to invite others within specified email domains  ;1180;44;Assign Chatter Free licenses to existing Salesforce users;0181;45;Opportunity update reminders  ;1182;45;Opportunity field history tracking  ;0183;45;Opportunity Escalation Rules  ;0184;45;Big deal alerts;1185;46;Role hierarchy  ;0186;46;Profile  ;1187;46;Public Groups  ;0188;46;Sharing Rules;0189;47;Create a roll-up summary field  ;1190;47;Create a new account record type  ;0191;47;Create a lookup field from accounts to opportunities  ;0192;47;Create a custom formula field;0193;48;Lead;0194;48;Account;1195;48;Contact;1196;48;Case;0197;49;Partner Portal User;1198;49;Queue;1199;49;Case team;0200;49;Contact;0201;49;Internal Salesforce User;1202;50;Ability to automatically assign a solution to all sub categories below the parent category  ;0203;50;Ability to create solution category custom reports to find uncategorized solutions  ;1204;50;Ability to control the visibility of specific solutions in the customer and self service portals  ;1205;50;Ability to control the visibility of specific solutions in the Solutions and Cases tabs;0206;51;Custom object tab names  ;0207;51;Standard Field labels  ;0208;51;Tab Colors and Fonts  ;1209;51;Page Layouts;1210;52;Validation rules;1211;52;Escalation rules;0212;52;Workflow rules;0213;52;Auto-response rules;0214;53;Select syncing direction and conflict behavior  ;1215;53;Assign users to Outlook configuration  ;1216;53;Specify a user's Outlook synchronization folders  ;0217;53;Run a first time synchronization for each user;0218;54;Gauge;0219;54;Bar;1220;54;Funnel;0221;54;Donut;0222;55;System administrators can access reports saved in user's personal folders  ;0223;55;"Users with the ""Manage Public Reports"" Permission can create report folders  ";1224;55;Each user has a personal folder for email templates, reports and documents  ;1225;55;Chatter Free users can access report folders but cannot see results returned in reports;0226;56;Each A record must have at least one related B record  ;1227;56;Each A record must have exactly one related B record  ;0228;56;Each A record does not have any related B records  ;0229;56;A records may or may not have related B records;1230;57;Documents tab  ;0231;57;Related list on case records  ;1232;57;Customer and Partner portals  ;1233;57;Chatter Knowledge tab;0234;58;Create a default sales team for each regional group and a lead assignment rule to route leads to the default sales team  ;0235;58;Create a queue for each regional group and a validation rule to enforce that the leads are assigned to the correct group  ;0236;58;Create a queue for the marketing team and a workflow alert to notify the team each time a lead is assigned to the queue  ;0237;58;Create a queue for each regional group and a lead assignment rule to route leads to the queues;1238;59;Move the opportunity reports into a folder with restricted access  ;0239;59;Move the opportunity reports into each users personal report folder  ;0240;59;"Use the ""Show"" filter to filter report results and reduce records returned  ";1241;59;Update the sharing rules to limit access certain opportunities;0242;60;The lead formula field value can be mapped to a roll up summary field on the account record  ;0243;60;The lead formula field can be mapped to a formula field on the account record  ;0244;60;The lead formula field can be mapped to a standard field on the account record  ;0245;60;The lead formula field value can be mapped to a number field on the account record;1246;61;Share folders with Public Groups  ;1247;61;Create and share data categories  ;0248;61;Designate running users  ;0249;61;Share folders with roles;1250;62;Remove all but one record type from the regional sales team profile  ;0251;62;Check for validation rule that restricts the visibility of the opportunity stage  ;0252;62;Ensure that regional sales users are routing consumer opportunities to the appropriate approver  ;0253;62;Assign the relevant record types and sales processes to the regional sales team profile;1254;63;To submit ideas for Salesforce application enhancements  ;0255;63;To find answers to Salesforce application questions  ;0256;63;When standard Salesforce functionality needs to be extended  ;1257;63;When looking for pre-built custom applications and tools;1258;64;Trending chatter topics  ;0259;64;Dashboard components  ;1260;64;Messages and alerts  ;1261;64;Analytic snapshots  ;0262;64;Pending approvals list;1263;65;"Admins can grant users the ""password never expires permission""  ";1264;65;Admins can reset passwords for all users at once  ;1265;65;Admins can customize the message sent to locked out users  ;1266;65;Admins can enforce an all numeric password policy  ;0267;65;Admins can assign a password to a set of users;0268;66;Create a custom profile and enable custom object permissions  ;1269;66;Use an existing custom profile that will automatically have the custom object permissions enabled  ;0270;66;Use an existing standard profile that will automatically have the custom object permissions enabled  ;0271;66;Modify a standard profile and enable custom object permissions;0272;67;The automated case user specified in the support settings  ;1273;67;The owner of the case when the rule was triggered  ;0274;67;The user who created the assignment or escalation rule  ;0275;67;The default case owner specified in the assignment or escalation rule;0276;68;Account record types  ;0277;68;Sharing rules  ;1278;68;Public groups  ;1279;68;Field level security;0280;69;Every time a user views a record  ;0281;69;Every time a record is saved;0282;69;Every time a record is updated  ;0283;69;Every time data is synchronized with the server;1284;70;Language  ;0285;70;Timezone  ;0286;70;Currency  ;0287;70;Date Fields;1288;71;Grant the user delegated administration rights to campaigns  ;0289;71;Select the marketing user checkbox on the user record  ;1290;71;Assign the user to the standard marketing user profile  ;0291;71;Create a campaign sharing rule to grant access to the user.;0292;72;"""Transfer"" access for leads, accounts, contacts, and opportunities  ";0293;72;"""Create"" and ""Edit"" access for leads, accounts, contacts and opportunities  ";1294;72;"""Convert Leads"" profile permission  ";1295;72;"""Import Leads"" profile permission";0296;73;Public Knowledge Base  ;1297;73;Salesforce Content  ;0298;73;Self Service Portal  ;1299;73;Solution tab search;0300;74;Knowledge automatically creates a solution for each new article  ;0301;74;Knowledge allows an organization to share articles with partner portal users  ;1302;74;Knowledge only allows a single article type across all data categories  ;0303;74;Knowledge uses data categories and roles to make articles visible to specific users;1304;75;Specify a default lead creator  ;0305;75;Specify a default lead owner  ;1306;75;Create a validation rule to route unassigned leads  ;0307;75;Create an escalation rule to route unassigned leads;0308;76;Big deal alert  ;0309;76;Similar Opportunities  ;1310;76;Chatter groups  ;1311;76;Opportunity Update Reminders;0312;77;Create a lookup relationship from the account page to the feedback object.  ;0313;77;Add fields from the feedback object to the account page layout.  ;0314;77;Assign the feedback page layout to the appropriate user profiles  ;1315;77;Create a role in the hierarchy to provide user access to the new object;0316;78;The dependent fields that appear on a layout  ;0317;78;The values that appear in the dependent field  ;1318;78;The default value populated in the dependent field  ;0319;78;The field-level security for the dependent field;0320;79;Grand Totals  ;1321;79;Grouped by field names  ;0322;79;Summary Formulas  ;1323;79;Date Fields  ;0324;79;Summarized Totals;1325;80;Enable field history tracking to send an email alert tot the account owner  ;0326;80;Create a workflow rule to send an email alert to the account owner  ;1327;80;Create an escalation rule to notify the account owner  ;0328;80;Create an auto-response rule to send an email alert to the account owner;0329;81;The running user determines the data displayed in the components on the dashboard  ;1330;81;Data access permissions determine what data the users can view in the source reports  ;1331;81;Only users in the same role as the running user can view the dashboard  ;0332;81;The running user becomes the default owner of the dashboard;0333;82;Data Loader  ;0334;82;Account analytic snapshot  ;0335;82;Account report export  ;0336;82;Data Export Service;1337;83;Associate existing contacts with the campaign  ;1338;83;Create a custom report including all campaign members  ;0339;83;Associate existing opportunities with the campaign  ;0340;83;Import new leads and associate them with the campaign;1341;84;Mobile Lite configurations can be created for each user  ;0342;84;Mobile Lite provides access to standard objects and dashboards  ;1343;84;Mobile Lite must be enabled before users can install it  ;1344;84;Mobile Lite users must have a mobile license assigned to them;0345;85;Email field  ;1346;85;Number field  ;1347;85;Formula field  ;0348;85;URL field  ;0349;85;Text field;1350;86;Sales quota  ;0351;86;Probability  ;1352;86;Amount rating  ;0353;86;Forecast category;1354;87;Tabular Reports  ;0355;87;Enhanced List Views  ;0356;87;Matrix Reports  ;1357;87;Summary Reports;1358;88;Opportunities;0359;88;Knowledge;1360;88;Dashboards;0361;88;Ideas;1362;89;Add the Do Not Contact field to the contact layout and make it visible for all sales user profiles.  ;1363;89;Make the DNC contact records private to all sales users  ;0364;89;Select the Mass Email checkbox on the DNC contact record  ;0365;89;Remove the phone number and email address fields from the contact page layout for DNC contacts  ;1366;89;Filter the DNC contacts from mass email list views shared with sales users;1367;90;Rename standard field labels in the user interface  ;1368;90;Edit picklist values for standard fields.  ;1369;90;Delete standard fields  ;0370;90;Remove no required standard fields from page layout  ;1371;90;Change the field type of standard fields;0372;91;Deleted fields and values can be restored from the recycle bin within 15 days  ;1373;91;Existing field values must be transferred to a new custom field  ;0374;91;Field values should be archived before a field is deleted  ;1375;91;Fields must be removed from the page layouts after being deleted  ;0376;91;Fields used in workflow and assignment rules cannot be deleted;1377;92;Opportunities for the entire sales organization regardless if the user running the report  ;0378;92;Opportunities owned by the user running the report and the users below them in the role hierarchy  ;1379;92;Opportunities for which the user running the report is also the account owner  ;0380;92;Opportunities owned by the user running the report and user in the same role in the role hierarchy;0381;93;Whether the user's profile has API enabled  ;0382;93;Whether a user's profile has login hour restriction  ;1383;93;Whether the user's profile has trusted IP addresses  ;1384;93;Whether the user's profile has trusted IP restrictions  ;1385;93;Whether the user's profile has specified business hours;0386;94;Open activities  ;1387;94;Closed cases  ;1388;94;Related custom object records  ;0389;94;Open cases  ;1390;94;Closed activities;0391;95;Assign feature license to users  ;1392;95;Delete user record  ;0393;95;Assign custom profiles to users  ;1394;95;Access a log of the records a user has viewed  ;0395;95;Reset all users passwords;1396;96;When different picklist values are required  ;1397;96;When multiple page layouts are required.  ;1398;96;When different record access is required  ;0399;96;When different field-level security is required;0400;97;Accounts  ;1401;97;Leads  ;0402;97;Contacts  ;1403;97;Opportunities  ;1404;97;Campaigns;0405;98;Trusted IP ranges  ;0406;98;Login hours  ;1407;98;Password policies  ;0408;98;Login IP ranges;1409;99;Create case auto-response rules to send an email to the customer within one hour of case creation  ;0410;99;Assign cases to a queue and create an escalation rule to escalate cases that have NOT been accepted by an agent within one hour  ;1411;99;Create a workflow rule to send an email to support managers when a case is created and assigned to a queue  ;0412;99;Create a workflow rule to assign a task to all support agents if a case has NOT been accepted by an agent within one hour;0413;100;Validation Rules;1414;100;Assignment Rules;2415;100;Workflow Rules;3416;100;Escalation Rules;4417;101;"Add the ""Manage Public Reports"" permission to the user's profile  ";1418;101;Enable the report builder feature for the user  ;0419;101;"Add the ""Manage Custom Report Types"" permission to the user's profile  ";0420;101;Grant the user access to the appropriate report folders;0421;102;Export opportunities and update using the import wizard  ;1422;102;Use similar opportunities to update the opportunities  ;0423;102;Create a list view for opportunities and update using inline editing  ;1424;102;Export opportunities and update using the data loader;0425;103;Table  ;1426;103;Chart  ;1427;103;Metric;0428;103;Gauge;0429;104;Edit a member's library permissions  ;0430;104;Add tags when editing content details  ;1431;104;Share content with other users in Chatter  ;1432;104;Create a new content library;0433;105;Share annotated approval process diagrams  ;1434;105;Edit the criteria used to trigger the approval process  ;0435;105;Add approval steps from the process visualizer  ;0436;105;View approval processes as a flow chart;1437;106;Sharing rules open up access to records  ;1438;106;Sharing rules grant record access to roles and public groups  ;1439;106;Sharing rules are required in public read/write organizations  ;0440;106;Sharing rules grant read/write or delete access to records;0441;107;Workflow rules with field updates;0442;107;Calculated columns in the related fields;0443;107;Cross- object formula fields;1444;107;Roll-up summary fields;0445;108;Delete the user account;0446;108;Deactivate and then delete the user account;0447;108;Change the user contract details for a new hire;0448;108;Deactivate the user account;1449;109;Create a case assignment rule.;0450;109;Create a case escalation rule;0451;109;Create an ownership-based sharing rule;1452;109;Create a criteria-based sharing rule.;0453;110;Create a validation rule;1454;110;Create a support process;0455;110;Create custom fields;1456;110;Create a page layout;0457;111;Self-service portal;1458;111;Salesforce Content;0459;111;Public Knowledge Base;1460;111;Solution tab search;0461;112;Add the business and consumer specific fields to a single opportunity page layout;0462;112;Create one page layout for business opportunities and another for consumer opportunities;1463;112;Add the business fields to the opportunity page layout and make read-only for consumer sales users.;0464;112;Create a custom object to capture the business and consumer specific data;0465;113;Campaign;0466;113;Case;0467;113;Account;1468;113;Opportunity;1469;114;Field-level security;0470;114;Record types;1471;114;Page layouts;1472;114;Support processes;1473;114;Permission sets;0474;115;The opportunity amount cannot be edited when products are related to the opportunity;1475;115;The opportunity amount is the sum of the related products;1476;115;Default schedules are not automatically created when a product is added to an opportunity;0477;115;Deleting a product from an opportunity deletes all quotes related to the opportunity;0478;115;All products added to an opportunity must come come from a single Price Book;1479;116;The business process and related picklist values displayed;0480;116;The fields users see in reports and list views;0481;116;The record types available to each role and profile;0482;116;The fields users see on detail and edit pages;1483;117;Dashboard components;1484;117;Trending Chatter topics;0485;117;Messages and alerts;1486;117;Analytic snapshots;0487;117;Pending approvals list;1488;118;Posts to a user’s profile are hidden from anyone below that user in the role hierarchy;0